{"schema_version":"1","task_id":null,"parent_task_id":"tsk_0mvbwk5ylc85dfbb13b95","title":"T124/T128/T129/T140 人の確認工程・投稿の再監査","task_type":"review","difficulty":"L2","quality_requirement":"normal","initiator":"claude","agent_name":null,"required_capabilities":["code","analysis"],"preferred_provider":null,"budget":{"max_usd":0,"max_total_tokens":null,"max_retries":1,"max_escalations":0},"input":{"prompt_file":"/Users/hongj/Documents/Codex/2026-10-08/ai-api-1-youtube-1-10/logs/2026-10-17/043529-T120-a3bf06b6/delegation/a.md","program":null,"workdir":"/Users/hongj/Documents/Codex/2026-10-08/ai-api-1-youtube-1-10","permission_profile":"read_only"},"expected_artifacts":[],"test_command":null,"audit":true}
