{"schema_version":"1","task_id":null,"parent_task_id":"tsk_0mvbt8ha6535f0021e619","title":"T172/T174/T168 の再監査","task_type":"review","difficulty":"L2","quality_requirement":"normal","initiator":"claude","agent_name":null,"required_capabilities":["code","analysis"],"preferred_provider":null,"budget":{"max_usd":0,"max_total_tokens":300000,"max_retries":1,"max_escalations":0},"input":{"prompt_file":"/Users/hongj/Documents/Codex/2026-10-08/ai-api-1-youtube-1-10/logs/2026-10-17/030502-T120-af598b96/delegation/c.md","program":null,"workdir":"/Users/hongj/Documents/Codex/2026-10-08/ai-api-1-youtube-1-10","permission_profile":"read_only"},"expected_artifacts":[],"test_command":null,"audit":true}
